{
  "$schema": "https://json-schema.org/draft/2020-12/schema",
  "title": "Professional Partner Campaign Company Profile v1",
  "type": "object",
  "additionalProperties": false,
  "required": ["schema_version", "profile_id", "company", "portal", "campaign", "storefront"],
  "properties": {
    "schema_version": { "const": 1 },
    "profile_id": { "type": "string", "maxLength": 80, "pattern": "^[a-z0-9][a-z0-9-]*$" },
    "company": {
      "type": "object",
      "additionalProperties": false,
      "required": ["subdomain", "display_name"],
      "properties": {
        "subdomain": { "type": "string", "maxLength": 63, "pattern": "^[a-z0-9](?:[a-z0-9-]{0,61}[a-z0-9])?$" },
        "display_name": { "type": "string", "minLength": 1, "maxLength": 120, "pattern": "^[^\\r\\n]+$" }
      }
    },
    "portal": {
      "type": "object",
      "additionalProperties": false,
      "required": ["definition_name", "definition_id", "screen_path", "anchor_id"],
      "properties": {
        "definition_name": { "type": "string", "minLength": 1, "maxLength": 120, "pattern": "^[^\\r\\n]+$" },
        "definition_id": { "type": "integer", "minimum": 1 },
        "screen_path": { "type": "string", "pattern": "^portal/screens/[a-z0-9-]+\\.json$" },
        "anchor_id": { "type": "string", "maxLength": 120, "pattern": "^[A-Za-z0-9-]+$" }
      }
    },
    "campaign": {
      "type": "object",
      "additionalProperties": false,
      "required": ["disclosure", "partner_segments", "goals"],
      "properties": {
        "disclosure": { "type": "string", "minLength": 1, "maxLength": 500, "pattern": "^[^\\r\\n]+$" },
        "partner_segments": { "type": "array", "minItems": 1, "maxItems": 20, "items": { "$ref": "#/$defs/segment" } },
        "goals": { "type": "array", "minItems": 1, "maxItems": 20, "items": { "$ref": "#/$defs/goal" } }
      }
    },
    "storefront": {
      "type": "object",
      "additionalProperties": false,
      "required": ["banner"],
      "properties": { "banner": { "$ref": "#/$defs/banner" } }
    }
  },
  "$defs": {
    "segment": {
      "type": "object",
      "additionalProperties": false,
      "required": ["id", "label", "audience_noun"],
      "properties": {
        "id": { "type": "string", "maxLength": 40, "pattern": "^[a-z0-9_]+$" },
        "label": { "type": "string", "minLength": 1, "maxLength": 80, "pattern": "^[^\\r\\n]+$" },
        "audience_noun": { "type": "string", "minLength": 1, "maxLength": 40, "pattern": "^[A-Za-z][A-Za-z -]*$" }
      }
    },
    "goal": {
      "type": "object",
      "additionalProperties": false,
      "required": ["id", "label"],
      "properties": {
        "id": { "type": "string", "maxLength": 40, "pattern": "^[a-z0-9_]+$" },
        "label": { "type": "string", "minLength": 1, "maxLength": 80, "pattern": "^[^\\r\\n]+$" }
      }
    },
    "banner": {
      "type": "object",
      "additionalProperties": false,
      "required": ["enabled", "name_prefix", "domain", "path", "country_ids", "language_ids", "placement", "behavior", "priority", "styles"],
      "properties": {
        "enabled": { "const": true },
        "name_prefix": { "type": "string", "maxLength": 80, "pattern": "^[a-z0-9][a-z0-9-]*$" },
        "domain": { "type": "string", "maxLength": 253, "pattern": "^(?=.{1,253}$)(?:[A-Za-z0-9](?:[A-Za-z0-9-]{0,61}[A-Za-z0-9])?\\.)+[A-Za-z]{2,63}$" },
        "path": { "type": "string", "maxLength": 200, "pattern": "^(?:\\*|/[A-Za-z0-9/_-]*\\*?)$" },
        "country_ids": { "type": "array", "minItems": 1, "maxItems": 100, "uniqueItems": true, "items": { "type": "integer", "minimum": 1 } },
        "language_ids": { "type": "array", "minItems": 1, "maxItems": 100, "uniqueItems": true, "items": { "type": "integer", "minimum": 1 } },
        "placement": { "enum": ["top", "bottom"] },
        "behavior": { "enum": ["dismissible", "sticky", "persistent"] },
        "priority": { "type": "integer", "minimum": 0, "maximum": 999 },
        "styles": {
          "type": "object",
          "additionalProperties": false,
          "required": ["width", "background_color", "text_color", "button_color", "button_text_color", "shadow"],
          "properties": {
            "width": { "enum": ["full_width", "contained"] },
            "background_color": { "type": "string", "pattern": "^#[0-9A-Fa-f]{6}$" },
            "text_color": { "type": "string", "pattern": "^#[0-9A-Fa-f]{6}$" },
            "button_color": { "type": "string", "pattern": "^#[0-9A-Fa-f]{6}$" },
            "button_text_color": { "type": "string", "pattern": "^#[0-9A-Fa-f]{6}$" },
            "shadow": { "enum": ["none", "small", "medium", "large"] }
          }
        }
      }
    }
  }
}
